### ISSUE TITLE
Clustering with nodes behind NAT 

### ISSUE THREAD

**Issue by sooslaca** [vernemq/vernemq#1554]
Hi Guys,

I try to setup clustering between 2 DCs where nodes are behind NAT  (docker with host network, but that shouldn't matter here)
DC A internal node IP is:  172.21.24.56
DC B internal node IP is: 172.22.24.50

DC B has this config:
```
listener.vmq.clustering = 172.22.24.50:44053
```
As I saw in other issues it's expected to be the defined 'private IP'

Cluster is forming nice:
```
root@ip-172-21-24-56:/docker/vernemq# docker exec -it vernemq vmq-admin cluster show
+--------------------------------+---------+
| Node                           | Running |
+-------------------------------+----------+
| VerneMQ@extdnsDC1.fqdn.here    | true    |
+-------------------------------+---------+
| VerneMQ@extdnsDC2.fqdn.here    | true    |
+-------------------------------+---------+
```

The problem is the following: DC A node has these logs:
```
08:58:36.247 [debug] started plumtree_metadata_manager exchange with 'VerneMQ@extdnsDC2.fqdn.here' (<0.2035.0>)
08:58:36.253 [debug] 0ms mailbox traversal, schedule next lazy broadcast in 10000ms, the min interval is 10000ms
08:58:36.531 [debug] completed metadata exchange with 'VerneMQ@extdnsDC2.fqdn.here'. nothing repaired
08:58:43.454 [warning] can't connect to cluster node 'VerneMQ@extdnsDC2.fqdn.here' due to timeout
```

Last line is my problem. DC A node just exchanged info with DC B node, even the cluster is forming and it can't connect?

Spent the past couple of hours on this and found that DC A node tries to communicate DC B node **on internal IP**??? why is that?

Here is the relevant tcpdump from DC Node A:
```
root@ip-172-21-24-56:/docker/vernemq/etc# tcpdump -n -e -ttt -i eth0 host 172.22.24.50
tcpdump: verbose output suppressed, use -v or -vv for full protocol decode
listening on eth0, link-type EN10MB (Ethernet), capture size 262144 bytes
 00:00:00.000000 02:78:e8:35:fe:88 > 02:93:fd:43:02:56, ethertype IPv4 (0x0800), length 74: 172.21.24.56.60837 > 172.22.24.50.44053: Flags [S], seq 1802232803, win 62727, options [mss 8961,sackOK,TS val 3826987808 ecr 0,nop,wscale 7], length 0
 00:00:03.861501 02:78:e8:35:fe:88 > 02:93:fd:43:02:56, ethertype IPv4 (0x0800), length 74: 172.21.24.56.52319 > 172.22.24.50.44053: Flags [S], seq 2497572922, win 62727, options [mss 8961,sackOK,TS val 3826991669 ecr 0,nop,wscale 7], length 0
 00:00:01.002486 02:78:e8:35:fe:88 > 02:93:fd:43:02:56, ethertype IPv4 (0x0800), length 74: 172.21.24.56.52319 > 172.22.24.50.44053: Flags [S], seq 2497572922, win 62727, options [mss 8961,sackOK,TS val 3826992672 ecr 0,nop,wscale 7], length 0
 00:00:02.016002 02:78:e8:35:fe:88 > 02:93:fd:43:02:56, ethertype IPv4 (0x0800), length 74: 172.21.24.56.52319 > 172.22.24.50.44053: Flags [S], seq 2497572922, win 62727, options [mss 8961,sackOK,TS val 3826994688 ecr 0,nop,wscale 7], length 0
```

Of course it's failing as there is not private connectivity between the two DCs.

I really expect to see traffic going to the NAT IP. It looks like EPMD somehow advertising the private IP address? can that be force overwritten somehow?
(Note: Under `NAT IP` I mean = external IP where `extdnsDC2.fqdn.here` points to)

And other traffic I see it's going right to external IP and port defined in `erlang.distribution.port_range`

### Environment

- VerneMQ Version:
```
root@ip-172-21-24-56:/docker/vernemq# docker exec -it vernemq vernemq version
1.10.3
```
- OS:
```
root@ip-172-21-24-56:/docker/vernemq# uname -a
Linux ip-172-21-24-56 5.4.0-1009-aws #9-Ubuntu SMP Sun Apr 12 19:46:01 UTC 2020 x86_64 x86_64 x86_64 GNU/Linux
root@ip-172-21-24-56:/docker/vernemq# cat /etc/os-release
NAME="Ubuntu"
VERSION="20.04 LTS (Focal Fossa)"
```
- Erlang/OTP version (if building from source):
``` Using docker imager: vernemq/vernemq   as of 20th June 2020  
root@ip-172-21-24-56:/docker/vernemq# docker pull vernemq/vernemq
Using default tag: latest
latest: Pulling from vernemq/vernemq
Digest: sha256:1e0f03db1a201406c84bd0e544250e28f64c4cf42c4fa34fefce19316a4b585e
Status: Image is up to date for vernemq/vernemq:latest
docker.io/vernemq/vernemq:latest
```
- VerneMQ configuration (vernemq.conf) or the changes from the default
- Cluster size/standalone: `2`

### Expected behavior

- Should not see the `con't connect to cluster node` message

### Actual behaviour

- 08:58:43.454 [warning] can't connect to cluster node 'VerneMQ@extdnsDC2.fqdn.here' due to timeout

**Comment by ioolkos** [comment]
The naming of `listener.vmq.clustering` is a little unfortunate for historical reasons.
This is not the actual clustering and metadata exchange layer. The listener on that port accepts connections from all other cluster nodes, to exchange MQTT messages exclusively.

That's the reason you see the error, which, I agree is confusing. And yes, this is normally not a port exposed to external world, as a VerneMQ cluster is built for LAN deployment.

**Comment by sooslaca** [comment]
I appreciate the answer @ioolkos .

I assume (whatever the name is) that this variable value is not just where VerneMQ listen/bind/accept connections, but it's also advertised through EPMD?
Is there no option to let the bind (listener) address and the advertised address be different?

"VerneMQ cluster is built for LAN deployment" < I read it on other issues - probably was answered by you that - it expects low latency and it might or might not work users who deploy it geographically different DCs.
Reading through docs (https://docs.vernemq.com/guides/typical-vernemq-deployment) it also suggest it's multiple nodes in same DC.

What I not found by myself in other threads/issues:
  Can/how can someone deploy VerneMQ to geographically different regions in a production environment?

Thank you
environment?

**Comment by ioolkos** [comment]
@sooslaca I know that a couple users are experimenting along those ideas... vpc peering etc. I don't have extensive feedback on that.
