### ISSUE TITLE
Broker sends RST on FIN after Disconnect

### ISSUE THREAD

**Issue by jorispz** [vernemq/vernemq#1433]
### Environment

- VerneMQ Version: 1.10.1
- OS: Amazon Linux 2
- Erlang/OTP version (if building from source): N/A
- Cluster size/standalone: cluster of 2 
- Using the HiveMQ Client version 1.1.3 on Java 1.8

### Expected behavior
When a connected client sends a `Disconnect` message and subsequently closes the connection with a FIN packet, the broker responds with a FIN ACK

### Actual behaviour
When running a Wireshark trace on a simple program that simply connects and disconnects to VerneMQ using the HiveMQ client, the following is logged:

```
      1 0.000000       192.168.0.1     10.0.0.1        TCP      66     11310 → 1883 [SYN] Seq=0 Win=64240 Len=0 MSS=1460 WS=256 SACK_PERM=1
      2 0.038508       10.0.0.1        192.168.0.1     TCP      66     1883 → 11310 [SYN, ACK] Seq=0 Ack=1 Win=26883 Len=0 MSS=1420 SACK_PERM=1 WS=128
      3 0.038739       192.168.0.1     10.0.0.1        TCP      54     11310 → 1883 [ACK] Seq=1 Ack=1 Win=131840 Len=0
      4 0.068941       192.168.0.1     10.0.0.1        MQTT     74     Connect Command
      5 0.105332       10.0.0.1        192.168.0.1     TCP      60     1883 → 11310 [ACK] Seq=1 Ack=21 Win=27008 Len=0
      6 0.105332       10.0.0.1        192.168.0.1     MQTT     60     Connect Ack
      7 0.152824       192.168.0.1     10.0.0.1        TCP      54     11310 → 1883 [ACK] Seq=21 Ack=6 Win=131840 Len=0
      8 0.206235       192.168.0.1     10.0.0.1        MQTT     56     Disconnect Req
      9 0.208518       192.168.0.1     10.0.0.1        TCP      54     11310 → 1883 [FIN, ACK] Seq=23 Ack=6 Win=131840 Len=0
     10 0.240008       10.0.0.1        192.168.0.1     TCP      60     1883 → 11310 [RST, ACK] Seq=6 Ack=23 Win=27008 Len=0
     11 0.246503       10.0.0.1        192.168.0.1     TCP      60     1883 → 11310 [RST] Seq=6 Win=0 Len=0
```

VerneMQ responds to the FIN with an RST instead of a FIN ACK. While this ultimately does not lead to major problems, it does lead to exceptional behaviour on the client side, see for example hivemq/hivemq-mqtt-client#373

**Comment by ioolkos** [comment]
@jorispz thanks.
I think you have to set "linger" to sth other than 0, if you want FIN ACKS.
Can you verify by doing as in this comment?:
https://github.com/vernemq/vernemq/issues/1409#issuecomment-574099245

**Comment by jorispz** [comment]
Yep, that seems to have done the trick:

```
No.     Time           Source                Destination           Protocol Length Info
     91 10.049421      192.168.0.1           10.0.0.1              TCP      66     38086 → 1883 [SYN] Seq=0 Win=64240 Len=0 MSS=1460 WS=256 SACK_PERM=1
     93 10.089956      10.0.0.1              192.168.0.1           TCP      66     1883 → 38086 [SYN, ACK] Seq=0 Ack=1 Win=26883 Len=0 MSS=1420 SACK_PERM=1 WS=128
     94 10.090053      192.168.0.1           10.0.0.1              TCP      54     38086 → 1883 [ACK] Seq=1 Ack=1 Win=131840 Len=0
     95 10.105072      192.168.0.1           10.0.0.1              MQTT     74     Connect Command
     98 10.144898      10.0.0.1              192.168.0.1           TCP      60     1883 → 38086 [ACK] Seq=1 Ack=21 Win=27008 Len=0
     99 10.329482      10.0.0.1              192.168.0.1           MQTT     60     Connect Ack
    100 10.378708      192.168.0.1           10.0.0.1              TCP      54     38086 → 1883 [ACK] Seq=21 Ack=6 Win=131840 Len=0
    101 10.602782      192.168.0.1           10.0.0.1              MQTT     56     Disconnect Req
    102 10.604235      192.168.0.1           10.0.0.1              TCP      54     38086 → 1883 [FIN, ACK] Seq=23 Ack=6 Win=131840 Len=0
    104 10.641253      10.0.0.1              192.168.0.1           TCP      60     1883 → 38086 [ACK] Seq=6 Ack=23 Win=27008 Len=0
    106 10.689244      10.0.0.1              192.168.0.1           TCP      60     1883 → 38086 [ACK] Seq=6 Ack=24 Win=27008 Len=0
    148 15.784878      10.0.0.1              192.168.0.1           TCP      60     1883 → 38086 [FIN, ACK] Seq=6 Ack=24 Win=27008 Len=0
    149 15.784985      192.168.0.1           10.0.0.1              TCP      54     38086 → 1883 [ACK] Seq=24 Ack=7 Win=131840 Len=0
```

Does this mean the default behaviour is by design?

**Comment by ioolkos** [comment]
It's certainly an aggressive default...  Will review it & probably adapt. (it protects server resources, TIME_WAITS and whatnot)

Client frameworks don't have to like it, but at least they shouldn't trip over it.
I don't want to start a philosophical debate, the good thing is that it's configurable :)

**Comment by jorispz** [comment]
Fair enough, and really the only issue on the hivemq client side is that it logs the forceful disconnect on error level, which is annoying but nothing terribly disastrous. Thanks for your time! Not sure if you want this issue to remain open as a reminder for your review, if not feel free to close it of course.

**Comment by ioolkos** [comment]
Thanks for the issue, and your review. Closing for now.
